<?xml version="1.0"?>
<!DOCTYPE Excel_Template_Description SYSTEM "ExcelDTD.dtd">
<Excel_Template_Description>
  <template>
    <template_name>OSR</template_name>
    <client_name>Shumen University</client_name>
    <data_views>
      <vuePositions id="v1" column_number="2" column_text="nameOfPosition"></vuePositions>
      <vuePositions id="v2" column_number="3" column_text="Education"></vuePositions>
      <vuePositions id="v3" column_number="4" column_text="otherRequirements"></vuePositions>
      <vuePositions id="v4" column_number="5" column_text="staffCount"></vuePositions>
      <vuePositions id="v6" column_number="6" column_text="NKPCode"></vuePositions>
      <vuePositions id="v7" column_number="7" column_text="StartSalary"></vuePositions>
      <vuePositions id="v8" column_number="8" column_text="BaseSalary"></vuePositions>
      <vuePositions id="v9" column_number="9" column_text="SalaryAddon"></vuePositions>
      <vuePositions id="v10" column_number="10" column_text="ScienceAddon"></vuePositions>
      <vuePositions id="v11" column_number="11" column_text="OtherAddon"></vuePositions>
    </data_views>
  </template>
</Excel_Template_Description>